standardized_test_metrics.csv

split,method,score_col,uses_obstruction,n_rows,spearman_delta_m,spearman_pareto,auc_top_repair,auc_top_obstruction_reduction
test,attribution_score,attribution_score,False,4608,0.9054687804719377,0.9054458661637258,0.9791025718669251,0.5184699006782946
test,abs_attribution_score,abs_attribution_score,False,4608,-0.12038487872864571,-0.11899448687842093,0.875258902616279,0.7180515180878553
test,grad_saliency_score,grad_saliency_score,False,4608,-0.18161535012450292,-0.18106383940827944,0.658086543120155,0.6690492772932817
test,activation_norm_score,activation_norm_score,False,4608,-0.24783372715891488,-0.24699164926836517,0.6935133034560723,0.7688590116279069
test,random_score,random_score,False,4608,0.011262917522599742,0.01138921882526904,0.502061127260982,0.48648861434108526
test,obstruction_only_score,obstruction_only_score,True,4608,0.08578375034607276,0.08931267104102292,0.5631570978682171,0.9429894420219638
test,std_response_a-1_g0,std_response_a-1_g0,True,4608,0.5377268178939278,0.5350785350838899,0.8109364906330749,0.15399255087209301
test,std_response_a-1_g0.1,std_response_a-1_g0.1,True,4608,0.5427289577788738,0.5400814412602041,0.8054773296188631,0.1520328649870801
test,std_response_a-1_g0.5,std_response_a-1_g0.5,True,4608,0.5542558233300006,0.5516498641647519,0.7792822391795866,0.14858335352067184
test,std_response_a-1_g1,std_response_a-1_g1,True,4608,0.5605209588656513,0.5581034423190563,0.7526854207041344,0.149570514373385
test,std_response_a-0.5_g0,std_response_a-0.5_g0,True,4608,0.7451187047377195,0.7431342576546371,0.9232648982558139,0.2795265059754522
test,std_response_a-0.5_g0.1,std_response_a-0.5_g0.1,True,4608,0.7502937223078605,0.7483090339617682,0.9161296834625323,0.2737751332364341
test,std_response_a-0.5_g0.5,std_response_a-0.5_g0.5,True,4608,0.7552322504819692,0.7534185273711547,0.8737236555232558,0.2609087330426357
test,std_response_a-0.5_g1,std_response_a-0.5_g1,True,4608,0.7447516106986337,0.7430463756932276,0.8438499273255814,0.2508720930232558
test,std_response_a0_g0,std_response_a0_g0,False,4608,0.8692800614543607,0.8691291848441495,0.9809254885335917,0.5165556363049095
test,std_response_a0_g0.1,std_response_a0_g0.1,False,4608,0.8779191869763858,0.8778678092294535,0.9774845566860465,0.5062151768410853
test,std_response_a0_g0.5,std_response_a0_g0.5,False,4608,0.8682191665319612,0.8682763379971423,0.9280563630490956,0.4633907663113695
test,std_response_a0_g1,std_response_a0_g1,False,4608,0.8484663800128001,0.8485084710036005,0.895960008882429,0.4344436369509044
test,std_response_a0.5_g0,std_response_a0.5_g0,True,4608,0.7324143371717352,0.7339439171945741,0.9414799337855297,0.7320670825258397
test,std_response_a0.5_g0.1,std_response_a0.5_g0.1,True,4608,0.742091540604122,0.7436735911058661,0.9363649668927648,0.7240138485142119
test,std_response_a0.5_g0.5,std_response_a0.5_g0.5,True,4608,0.7529100729804012,0.7545534017606551,0.907640907622739,0.6877881742571059
test,std_response_a0.5_g1,std_response_a0.5_g1,True,4608,0.7504862610092429,0.7520530730971323,0.8762707929586563,0.6372325177648579
test,std_response_a1_g0,std_response_a1_g0,True,4608,0.5684577657834222,0.5706244153091556,0.8623813993863049,0.8422606791020671
test,std_response_a1_g0.1,std_response_a1_g0.1,True,4608,0.576392515805919,0.5785794067214467,0.8580784681847545,0.8360106791020672
test,std_response_a1_g0.5,std_response_a1_g0.5,True,4608,0.5993259995541259,0.6015122791406741,0.8436763162144703,0.8051704820736434
test,std_response_a1_g1,std_response_a1_g1,True,4608,0.6092167682495438,0.6113706133695511,0.8221071543927648,0.7724165253552971
test,std_response_a2_g0,std_response_a2_g0,True,4608,0.3789662243655643,0.3815557074779319,0.7572926760335917,0.923101885497416
test,std_response_a2_g0.1,std_response_a2_g0.1,True,4608,0.384106432435622,0.386701806999159,0.7554414970930232,0.9215787508074935
test,std_response_a2_g0.5,std_response_a2_g0.5,True,4608,0.40240807705584236,0.4050235677002872,0.7478959746447028,0.911882772125323
test,std_response_a2_g1,std_response_a2_g1,True,4608,0.4192782142598909,0.4218314419761266,0.7351612968346253,0.8939276485788114
test,std_attr_only,std_attr_only,False,4608,0.8692800614543607,0.8691291848441495,0.9809254885335917,0.5165556363049095
test,std_obst_only,std_obst_only,True,4608,0.05896098003887049,0.0618860997738562,0.5631767805232558,0.9710957687338502
test,std_attr_cost_g0.1,std_attr_cost_g0.1,False,4608,0.8779191869763858,0.8778678092294535,0.9774845566860465,0.5062151768410853
test,std_attr_norm_g0.1,std_attr_norm_g0.1,False,4608,0.8856880816605336,0.8855652638961481,0.9767618499677002,0.494616541505168
test,std_attr_cost_g0.5,std_attr_cost_g0.5,False,4608,0.8682191665319612,0.8682763379971423,0.9280563630490956,0.4633907663113695
test,std_attr_norm_g0.5,std_attr_norm_g0.5,False,4608,0.8423800937858231,0.8421387981825094,0.9093174660852713,0.41368095930232557
test,std_attr_cost_g1,std_attr_cost_g1,False,4608,0.8484663800128001,0.8485084710036005,0.895960008882429,0.4344436369509044
test,std_attr_norm_g1,std_attr_norm_g1,False,4608,0.7328307499245348,0.7323542855988697,0.8005046834625323,0.3563413477067183
test,raw_response_beta0.0_gamma0.0,response_score,True,4608,0.08578375034607276,0.08931267104102292,0.5631570978682171,0.9429894420219638
test,raw_response_beta0.0_gamma0.0001,response_score,True,4608,0.2356207870651991,0.2382248579189906,0.4558003270348837,0.7017951590762274
test,raw_response_beta0.0_gamma0.001,response_score,True,4608,0.2644616712019796,0.2644733335600837,0.32577367974806204,0.31649961644056845
test,raw_response_beta0.0_gamma0.01,response_score,True,4608,0.2497594882883506,0.24899080758654643,0.3072371608527132,0.2371981992894057
test,raw_response_beta0.25_gamma0.0,response_score,True,4608,0.9004839509891343,0.9009950720567382,0.97781209625323,0.549523074127907
test,raw_response_beta0.25_gamma0.0001,response_score,True,4608,0.9108719433567968,0.9115261213493302,0.9650213985788114,0.5298247739018088
test,raw_response_beta0.25_gamma0.001,response_score,True,4608,0.8499865829696545,0.8504328266014153,0.8565946988049096,0.4230589874031008
test,raw_response_beta0.25_gamma0.01,response_score,True,4608,0.4556078168433853,0.45500561004431195,0.4857532905361757,0.26904927729328165
test,raw_response_beta0.5_gamma0.0,response_score,True,4608,0.904627030605335,0.9048804550195623,0.9788113695090439,0.5334034843346254
test,raw_response_beta0.5_gamma0.0001,response_score,True,4608,0.9129878271094898,0.9133502915405908,0.9752538557816538,0.5247764252260982
test,raw_response_beta0.5_gamma0.001,response_score,True,4608,0.897143104957857,0.897543218635666,0.9026374757751938,0.45502917070413434
test,raw_response_beta0.5_gamma0.01,response_score,True,4608,0.5797312494068606,0.5792902133033623,0.60179566375969,0.2982775153423773
test,raw_response_beta1.0_gamma0.0,response_score,True,4608,0.9053756392878607,0.905491082699099,0.9790793564276485,0.525867550872093
test,raw_response_beta1.0_gamma0.0001,response_score,True,4608,0.9109327341333223,0.9110999539203464,0.9780048853359173,0.5220576954134367
test,raw_response_beta1.0_gamma0.001,response_score,True,4608,0.9087445458282901,0.9090790337780604,0.9260118903423773,0.47545371043281653
test,raw_response_beta1.0_gamma0.01,response_score,True,4608,0.7181462065508472,0.7179417395267983,0.7329553254198966,0.3382156411498708
test,raw_response_beta2.0_gamma0.0,response_score,True,4608,0.905416337972709,0.905461963261118,0.979092982881137,0.5221667070413437
test,raw_response_beta2.0_gamma0.0001,response_score,True,4608,0.9087536851716882,0.9088235907632893,0.9789158389857882,0.5203493418927648
test,raw_response_beta2.0_gamma0.001,response_score,True,4608,0.9140651256081798,0.9142768374426599,0.9547480620155039,0.49324481185400515
test,raw_response_beta2.0_gamma0.01,response_score,True,4608,0.8258437179831843,0.8258528435945419,0.831148558624031,0.3843220082364341

standardized_decision_summary.md

## Held-Out Performance

- with obstruction: `raw_response_beta2.0_gamma0.001` Spearman Pareto 0.9143, AUC repair 0.9547, Spearman delta_m 0.9141
- without obstruction: `attribution_score` Spearman Pareto 0.9054, AUC repair 0.9791, Spearman delta_m 0.9055